{
  "commit_marker": "COMMITTED",
  "committed": true,
  "document_envelope_refs": [
    {
      "contract_id": "envelope_contract_example001",
      "path": "documents/document_example001/document_envelope.json",
      "schema_id": "document_source.document_envelope",
      "schema_version": "2.0.0",
      "sha256": "1111111111111111111111111111111111111111111111111111111111111111"
    }
  ],
  "error_catalog_ref": {
    "contract_id": "errors_contract_example001",
    "path": "errors/error_catalog.json",
    "schema_id": "document_source.error_catalog",
    "schema_version": "2.0.0",
    "sha256": "1111111111111111111111111111111111111111111111111111111111111111"
  },
  "files": [
    {
      "path": "request/normalized_request.json",
      "role": "contract",
      "sha256": "2222222222222222222222222222222222222222222222222222222222222222",
      "size_bytes": 100
    }
  ],
  "header": {
    "content_hash": "5e7aabf53706e01b98bc0a4b0505296f9b0f2796754accf323d971b857099201",
    "contract_id": "package_contract_example001",
    "created_at": "2026-06-19T20:00:00Z",
    "extensions": {},
    "producer": "vysi.document_source",
    "producer_version": "0.2.0",
    "revision": 1,
    "schema_id": "document_source.package_manifest",
    "schema_version": "2.0.0",
    "status": "review",
    "supersedes": null
  },
  "package_id": "package_example001",
  "request_ref": {
    "contract_id": "normalized_request_example001",
    "path": "request/normalized_request.json",
    "schema_id": "document_source.normalized_source_request",
    "schema_version": "2.0.0",
    "sha256": "1111111111111111111111111111111111111111111111111111111111111111"
  },
  "run_id": "run_example001",
  "validation_report_ref": {
    "contract_id": "validation_contract_example001",
    "path": "reports/validation_report.json",
    "schema_id": "document_source.validation_report",
    "schema_version": "2.0.0",
    "sha256": "1111111111111111111111111111111111111111111111111111111111111111"
  }
}
